{"counts":{"archive":1,"context":1,"explicit":2,"facet_gap_known_disjoint":1,"facet_gap_unknown":1,"ghosts":1,"latent":1,"nodes":4,"primary":1,"severed":1},"edge_fields":["a","b","weight","facet","reach","span","facet_gap","relevance","reason","signals","presentation"],"explicit":[[0,1,0.82,0,0.55,0.2,0,0.88,0,12,"primary"],[0,2,0.64,-1,0.42,0.3,-1,0.7,1,5,"context"]],"facet_vocab":["graph","evidence","history"],"ghosts":[{"anchors":[{"n":2,"w":0.4}],"docs":2,"name":"Unlinked interface examples"}],"latent":[[0,3,0.41,2,0.2,0.76,1,0.52,2,3,"archive"]],"legend":{"facet_gap":{"0":"at least one controlled facet is shared","1":"both controlled-facet sets are present and known-disjoint","-1":"unknown because one or both endpoints lack controlled facets"},"presentation":{"archive":"lower-priority relationship","context":"supporting relationship","primary":"highest-priority relationship"},"synthesis":{"activation":"bounded participation in the current frame","confidence":"support quality, independence, freshness, coverage, and residual penalty","importance":"structural priority, not truth","utility":"frame-scoped usefulness, not universal value"}},"nodes":[{"age":0,"aliases":["Useful connections"],"area":"Knowledge graphs","authority":"synthetic","authority_rank":1,"contested":false,"corroboration":3,"description":"graph-relevance · progressive-disclosure · graph · knowledge-graphs · focus","display_tags":["graph","relevance"],"display_title":"Ranking useful graph connections","display_title_source":"frontmatter","evidence":"verified-source","facets":["graph","relevance"],"family":"example-method","hand_authored":true,"hybridity":0.25,"id":"synthetic-focus","label_area":"Knowledge graphs","label_source":"document","load":0.72,"mass":1,"path":"Synthetic/Ranking useful graph connections.md","privacy":"agent-safe","project":"Example","role":"focus","source_commit":null,"source_path":null,"source_sha256":null,"source_tree_dirty":false,"standing":0.78,"standing_parts":{"contested":false,"corroboration":3,"load":3,"provenance":0.9},"synthesis":{"activation":{"direct":0,"inhibited":0,"propagated":0,"score":0},"confidence":{"parts":{"coverage":0.875,"evidence":0.9,"freshness":1,"independence":0,"residual":0},"score":0.6425},"contexts":[["knowledge-graphs",0.55],["focus",0.5],["example-method",0.45]],"importance":{"parts":{"authority":0.25,"load":0.782409,"standing":0.78,"support":0},"score":0.557723},"region_attribution":[["base-graph",0.895]],"residuals":[],"subjects":[["graph-relevance",0.55],["progressive-disclosure",0.5],["graph",0.45],["relevance",0.4]],"support":{"independent":0,"lineages":0,"regions":1},"utility":{"frame_ref":"resting-17299bb457673666","parts":{"direct":0,"goal":0,"neighbour":0},"score":0}},"tags":["graph","relevance"],"title":"Ranking useful graph connections","topics":["graph relevance","progressive disclosure"],"type":"concept","view_scope":"core","withhold_from_telemetry":false},{"age":0,"aliases":[],"area":"Knowledge graphs","authority":"synthetic","authority_rank":1,"contested":false,"corroboration":3,"description":"edge-evidence · graph-relevance · graph · knowledge-graphs · support","display_tags":["graph","evidence"],"display_title":"Explainable edge evidence","display_title_source":"heading","evidence":"verified-source","facets":["graph","evidence"],"family":"example-method","hand_authored":true,"hybridity":0.18,"id":"synthetic-primary","label_area":"Knowledge graphs","label_source":"document","load":0.61,"mass":0.9,"path":"Synthetic/Explainable edge evidence.md","privacy":"agent-safe","project":"Example","role":"support","source_commit":null,"source_path":null,"source_sha256":null,"source_tree_dirty":false,"standing":0.7,"standing_parts":{"contested":false,"corroboration":3,"load":2,"provenance":0.9},"synthesis":{"activation":{"direct":0,"inhibited":0,"propagated":0,"score":0},"confidence":{"parts":{"coverage":0.875,"evidence":0.9,"freshness":1,"independence":0,"residual":0},"score":0.6425},"contexts":[["knowledge-graphs",0.55],["support",0.5],["example-method",0.45]],"importance":{"parts":{"authority":0.25,"load":0.687061,"standing":0.7,"support":0},"score":0.501118},"region_attribution":[["base-graph",0.875]],"residuals":[],"subjects":[["edge-evidence",0.55],["graph-relevance",0.5],["graph",0.45],["evidence",0.4]],"support":{"independent":0,"lineages":0,"regions":1},"utility":{"frame_ref":"resting-17299bb457673666","parts":{"direct":0,"goal":0,"neighbour":0},"score":0}},"tags":["graph","evidence"],"title":"Explainable edge evidence","topics":["edge evidence","graph relevance"],"type":"method","view_scope":"core","withhold_from_telemetry":false},{"age":0,"aliases":[],"area":"Interfaces","authority":"synthetic","authority_rank":1,"contested":false,"corroboration":2,"description":"progressive-disclosure · interface-clarity · interfaces · context","display_tags":["interface"],"display_title":"Progressive graph disclosure","display_title_source":"filename","evidence":"inferred","facets":[],"family":"example-interface","hand_authored":true,"hybridity":0.32,"id":"synthetic-context","label_area":"Interfaces","label_source":"document","load":0.43,"mass":0.7,"path":"Synthetic/Progressive graph disclosure.md","privacy":"agent-safe","project":"Example","role":"context","source_commit":null,"source_path":null,"source_sha256":null,"source_tree_dirty":false,"standing":0.52,"standing_parts":{"contested":false,"corroboration":2,"load":1,"provenance":0.6},"synthesis":{"activation":{"direct":0,"inhibited":0,"propagated":0,"score":0},"confidence":{"parts":{"coverage":0.625,"evidence":0.65,"freshness":1,"independence":0,"residual":0},"score":0.505},"contexts":[["interfaces",0.55],["context",0.5],["example-interface",0.45]],"importance":{"parts":{"authority":0.25,"load":0.516015,"standing":0.52,"support":0},"score":0.386805},"region_attribution":[["base-graph",0.705]],"residuals":[],"subjects":[["progressive-disclosure",0.55],["interface-clarity",0.5]],"support":{"independent":0,"lineages":0,"regions":1},"utility":{"frame_ref":"resting-17299bb457673666","parts":{"direct":0,"goal":0,"neighbour":0},"score":0}},"tags":["interface"],"title":"Progressive graph disclosure","topics":["progressive disclosure","interface clarity"],"type":"design-note","view_scope":"corpus","withhold_from_telemetry":false},{"age":3,"aliases":[],"area":"History","authority":"synthetic","authority_rank":0,"contested":false,"corroboration":1,"description":"","display_tags":["history"],"display_title":"Historical graph sketch","display_title_source":"filename","evidence":"reported","facets":["history"],"family":"example-history","hand_authored":true,"hybridity":0.1,"id":"synthetic-archive","label_area":"History","label_source":"document","load":0.2,"mass":0.4,"path":"Synthetic/Historical graph sketch.md","privacy":"private-local","project":"Example","role":"archive","source_commit":null,"source_path":null,"source_sha256":null,"source_tree_dirty":false,"standing":0.31,"standing_parts":{"contested":false,"corroboration":1,"load":0,"provenance":0.4},"synthesis":{"activation":{"direct":0,"inhibited":0,"propagated":0,"score":0},"confidence":{"parts":{"coverage":0.625,"evidence":0.45,"freshness":1,"independence":0,"residual":0},"score":0.415},"contexts":[["history",0.55],["archive",0.5],["example-history",0.45]],"importance":{"parts":{"authority":0,"load":0.263034,"standing":0.31,"support":0},"score":0.18741},"region_attribution":[["base-graph",0.5525]],"residuals":[],"subjects":[["historical-design",0.55],["history",0.5]],"support":{"independent":0,"lineages":0,"regions":1},"utility":{"frame_ref":"resting-17299bb457673666","parts":{"direct":0,"goal":0,"neighbour":0},"score":0}},"tags":["history"],"title":"Historical graph sketch","topics":["historical design"],"type":"archive-note","view_scope":"all","withhold_from_telemetry":true}],"observed_at":"2026-08-02T00:00:00Z","presentation_vocab":["primary","context","archive"],"reason_vocab":[{"basis":["declared-link","controlled-facet"],"evidence":"verified-source","label":"explicit link and shared facet"},"corroborated topical context",{"basis":["declared-link"],"evidence":"reported","label":"historical reference"}],"schema":"aethergraph.v4","severed":[{"curated":["suppressed in focused mode",null],"pair":["synthetic-primary","synthetic-archive"],"shared_areas":0}],"synthesis":{"algorithm":"holistic-modulator-v1","authority":"none","base":{"agent_index_sha256":null,"graph_sha256":"17299bb457673666c7b29a811acc21b0d8ec79792a2b82def0fa0583de7779bd"},"budget":{"edge_limit":512,"node_limit":128,"selected_edges":2,"selected_nodes":3,"token_estimate_limit":8192},"frame_ref":"resting-17299bb457673666","mode":"resting","regions":[{"activation":1,"confidence":0.8,"contributions":5,"derivation_family":"base-graph","gain":1,"id":"base-graph","inhibition":0,"observed_at":"2026-08-02T00:00:00Z","omissions":[],"source_snapshot_sha256":"17299bb457673666c7b29a811acc21b0d8ec79792a2b82def0fa0583de7779bd","status":"active"}],"residuals":[],"schema":"aethergraph.synthesis.v1","working_set":["synthetic-focus","synthetic-primary","synthetic-context"]}}
